{
  "schema_version": "2.0-rc1",
  "kind": "EDITORIAL_PUBLICATION_SET_V1",
  "status": "SEALED_INERT",
  "issue_id": "SP001",
  "research_profile": "THEMATIC",
  "publication_profile": "LONGFORM_SPECIAL",
  "proposal_ref": {
    "path": "sources/SP001/publication/v2/editorial-corrections/ed-thematic-full-ren-c-v2/proposal.json",
    "sha256": "506b7bb46e3cc09540e35a8d42a86984f2818c723e963a0dfb04c47ff3bc853c"
  },
  "staged_manifest_ref": {
    "path": "sources/SP001/publication/v2/editorial-corrections/ed-thematic-full-ren-c-v2/staged-source/staged-source-manifest.json",
    "sha256": "df8116d1401d7959976985d46bc1274657e5b35d3aed1d6ca2c8b7360675468c"
  },
  "build_record_ref": {
    "path": "sources/SP001/publication/v2/editorial-corrections/ed-thematic-full-ren-c-v2/publication/build-record.json",
    "sha256": "1553b94667ba326d90db9b677017d14f18b4f2c52f85182f69fc91f3bc4fcc46"
  },
  "roles": {
    "reader-input": {
      "path": "sources/SP001/publication/v2/editorial-corrections/ed-thematic-full-ren-c-v2/reader-surface-input-v2.json",
      "sha256": "7edd7553efd49db42729bc96a352ca9cb188db78e16baa4b11f8371c0a891018",
      "byte_count": 7993
    },
    "authoring-input": {
      "path": "sources/SP001/publication/v2/editorial-corrections/ed-thematic-full-ren-c-v2/authoring-input.json",
      "sha256": "ff8fccd818757228f2721f13fb4b95a33d9455dfe6491eafa71af97dff98be73",
      "byte_count": 6114
    },
    "source-receipt": {
      "path": "sources/SP001/publication/v2/editorial-corrections/ed-thematic-full-ren-c-v2/publication/validated-source-manifest.json",
      "sha256": "713f40fe68c6b823a56b7887d0df6efadccf22631a9f83893017a49ee640eaee",
      "byte_count": 21771
    },
    "reader-manuscript": {
      "path": "sources/SP001/publication/v2/editorial-corrections/ed-thematic-full-ren-c-v2/publication/reader-manuscript-v2.json",
      "sha256": "37fd72507ce7dd441f4fd81680190e25dc8060c5dcd13f26fa7818652d5f4c46",
      "byte_count": 2460
    },
    "validated-source": {
      "path": "sources/SP001/publication/v2/editorial-corrections/ed-thematic-full-ren-c-v2/staged-source/main.tex",
      "sha256": "4dda1b746a2001f5cdde558792c18010065e56aaf4789a8b57167cc9285ea14b",
      "byte_count": 5954
    },
    "bibliography": {
      "path": "sources/SP001/publication/v2/editorial-corrections/ed-thematic-full-ren-c-v2/staged-source/references.bib",
      "sha256": "594e229e425c3f12a6794f1e82a4ae4f9190ab575f958f49617b00af111a394f",
      "byte_count": 177
    },
    "style": {
      "path": "sources/SP001/publication/v2/editorial-corrections/ed-thematic-full-ren-c-v2/staged-source/jgaisurvey.sty",
      "sha256": "035645caa06eb77e5416ae7a54bc1fb7b987e0b575a02bd4b512bccb5d683aec",
      "byte_count": 6569
    },
    "publication-pdf": {
      "path": "sources/SP001/publication/v2/editorial-corrections/ed-thematic-full-ren-c-v2/publication/build/main.pdf",
      "sha256": "2e0c889b2c50b20d0b6a33d61cbee8f2554e36234f38b01ad547c31e373eb11d",
      "byte_count": 85756
    },
    "build-log": {
      "path": "sources/SP001/publication/v2/editorial-corrections/ed-thematic-full-ren-c-v2/publication/build/main.log",
      "sha256": "245566d543a0ca97bc3787dfe851404a41becba2cb08f15cbddd2e9798cbef1d",
      "byte_count": 86584
    },
    "pdf-digest": {
      "path": "sources/SP001/publication/v2/editorial-corrections/ed-thematic-full-ren-c-v2/publication/build/main.pdf.sha256",
      "sha256": "1b9f873147da380df0d18c0190b11701e4bc5e2c9c63457e42aab0e78cc27db3",
      "byte_count": 65
    },
    "quality-regression-bundle": {
      "path": "sources/SP001/publication/v2/editorial-corrections/ed-thematic-full-ren-c-v2/publication/quality-regression-bundle-v2.json",
      "sha256": "85076e26416878afd2daf4425863ff5c90a75c26f3b8c21a19a02c5528038f02",
      "byte_count": 3186
    },
    "semantic-review": {
      "path": "sources/SP001/publication/v2/editorial-corrections/ed-thematic-full-ren-c-v2/publication/semantic-editorial-review-v2.json",
      "sha256": "dff7e8a56a41f0c7042711a44b8cf9710f0c28ca62331dc26e5ce67358333ea4",
      "byte_count": 3490
    },
    "visual-review": {
      "path": "sources/SP001/publication/v2/editorial-corrections/ed-thematic-full-ren-c-v2/publication/visual-review-v2.json",
      "sha256": "75e7d8a7912a217ef3ac6cebffeab8fa4baadd96b4ba0c0603f9d0bf41da9de2",
      "byte_count": 2487
    },
    "reader-surface-gate": {
      "path": "sources/SP001/publication/v2/editorial-corrections/ed-thematic-full-ren-c-v2/publication/reader-surface-gate-v2.json",
      "sha256": "d3ea23fa092cafc9ff606a06af7e30c93fb21da60d3011bf1f63b3c36aee55d0",
      "byte_count": 5490
    },
    "publication-candidate": {
      "path": "sources/SP001/publication/v2/editorial-corrections/ed-thematic-full-ren-c-v2/publication/publication-candidate-v2.json",
      "sha256": "4c16a6ef429f4603acce635e0a9a542bd6056f03b201522a58634467acbe456e",
      "byte_count": 1865
    }
  },
  "set_sha256": "d0d0809eece1f9a11f78734ab94ed1317a920da76d6b3cbe16a8a23179775b44"
}
