{
  "schema_version": "2.0-rc1",
  "kind": "EDITORIAL_PUBLICATION_SET_V1",
  "status": "SEALED_INERT",
  "issue_id": "2026-W33",
  "research_profile": "WEEKLY",
  "publication_profile": "WEEKLY_MAGAZINE",
  "proposal_ref": {
    "path": "sources/2026-W33/publication/v2/editorial-corrections/ed-weekly-full-cuu-rel-v2/proposal.json",
    "sha256": "c45aefc447865d68533d92cdb9d0eb29bd3197dfa288403c8ba0aa28bbc4fc28"
  },
  "staged_manifest_ref": {
    "path": "sources/2026-W33/publication/v2/editorial-corrections/ed-weekly-full-cuu-rel-v2/staged-source/staged-source-manifest.json",
    "sha256": "8e320e2cb6c32d1bb96acbae3253a6a12a69edabe4c5e67fa53cae1a3fd1d95b"
  },
  "build_record_ref": {
    "path": "sources/2026-W33/publication/v2/editorial-corrections/ed-weekly-full-cuu-rel-v2/publication/build-record.json",
    "sha256": "b225bc6fc0546853b2c012a5fdf94b200acb61a18155e28a3a2026e9994513e9"
  },
  "roles": {
    "reader-input": {
      "path": "sources/2026-W33/publication/v2/editorial-corrections/ed-weekly-full-cuu-rel-v2/reader-surface-input-v2.json",
      "sha256": "37f152ad94ee1d10a16cd725a03a2cb5db3de56fc8bb717193fe37cd03d79ba3",
      "byte_count": 3355
    },
    "authoring-input": {
      "path": "sources/2026-W33/publication/v2/editorial-corrections/ed-weekly-full-cuu-rel-v2/authoring-input.json",
      "sha256": "809411dde0828eea15643a39991f9e1d48f1eec67ba232da71b7c4903c133f32",
      "byte_count": 1001
    },
    "source-receipt": {
      "path": "sources/2026-W33/publication/v2/editorial-corrections/ed-weekly-full-cuu-rel-v2/publication/validated-source-manifest.json",
      "sha256": "af88b04fca4f073b7a232eee346a521980d8b5877b3a8ce769da40d824b9ac00",
      "byte_count": 21825
    },
    "reader-manuscript": {
      "path": "sources/2026-W33/publication/v2/editorial-corrections/ed-weekly-full-cuu-rel-v2/publication/reader-manuscript-v2.json",
      "sha256": "5aab4cae5d18c4c30b549c774f656fe9f7ebbc62ca84637992fc7c11a5fda071",
      "byte_count": 2661
    },
    "validated-source": {
      "path": "sources/2026-W33/publication/v2/editorial-corrections/ed-weekly-full-cuu-rel-v2/staged-source/main.tex",
      "sha256": "b0437b09798f367173588c9b9602403022c899ed726f148a054110072866c02c",
      "byte_count": 2323
    },
    "bibliography": {
      "path": "sources/2026-W33/publication/v2/editorial-corrections/ed-weekly-full-cuu-rel-v2/staged-source/references.bib",
      "sha256": "4c832136678ccebfaf4f73e0d8a5ecc281a080d0189743f6f0541998d1f96dc0",
      "byte_count": 172
    },
    "style": {
      "path": "sources/2026-W33/publication/v2/editorial-corrections/ed-weekly-full-cuu-rel-v2/staged-source/jgaisurvey.sty",
      "sha256": "035645caa06eb77e5416ae7a54bc1fb7b987e0b575a02bd4b512bccb5d683aec",
      "byte_count": 6569
    },
    "publication-pdf": {
      "path": "sources/2026-W33/publication/v2/editorial-corrections/ed-weekly-full-cuu-rel-v2/publication/build/main.pdf",
      "sha256": "2ec86634713a74cfbee4054e426ab14075041b8192ab719e71adcc56837b2279",
      "byte_count": 67729
    },
    "build-log": {
      "path": "sources/2026-W33/publication/v2/editorial-corrections/ed-weekly-full-cuu-rel-v2/publication/build/main.log",
      "sha256": "2809e5a2722db2950860ab04ef6006723686e3a68665ce3f3ceaea63cd163d39",
      "byte_count": 85527
    },
    "pdf-digest": {
      "path": "sources/2026-W33/publication/v2/editorial-corrections/ed-weekly-full-cuu-rel-v2/publication/build/main.pdf.sha256",
      "sha256": "8d643b578408dd5a9ad8db6897915d344b83008a66dff2005583e730fb78585c",
      "byte_count": 65
    },
    "quality-regression-bundle": {
      "path": "sources/2026-W33/publication/v2/editorial-corrections/ed-weekly-full-cuu-rel-v2/publication/quality-regression-bundle-v2.json",
      "sha256": "6659ab20c73333492373bc6b93e49b3f108ce50bf7f081ea0022870b3c7af1a3",
      "byte_count": 2638
    },
    "semantic-review": {
      "path": "sources/2026-W33/publication/v2/editorial-corrections/ed-weekly-full-cuu-rel-v2/publication/semantic-editorial-review-v2.json",
      "sha256": "ecb400d6889d965e09f0244ad1ecb25fc2b50797e2c2b9cd89b6a5bffaab5d32",
      "byte_count": 3885
    },
    "visual-review": {
      "path": "sources/2026-W33/publication/v2/editorial-corrections/ed-weekly-full-cuu-rel-v2/publication/visual-review-v2.json",
      "sha256": "cdb806dd8231ddba448e955297ee6de737f67137e792dfbb072b3291577114f1",
      "byte_count": 1767
    },
    "reader-surface-gate": {
      "path": "sources/2026-W33/publication/v2/editorial-corrections/ed-weekly-full-cuu-rel-v2/publication/reader-surface-gate-v2.json",
      "sha256": "e89f557b1ce3b9d11abce0bce4d11146d7cb38686fada5c741557e5abdd74f47",
      "byte_count": 5516
    },
    "publication-candidate": {
      "path": "sources/2026-W33/publication/v2/editorial-corrections/ed-weekly-full-cuu-rel-v2/publication/publication-candidate-v2.json",
      "sha256": "5462dc1653f8d6df47fbb50283c40928fba5697a10f42e84eb3b517328e9cc7e",
      "byte_count": 1885
    }
  },
  "set_sha256": "a628f7840ff0ebc9b7ba9876d26880b246f940879d845b954e48876577e663dc"
}
