{
  "schema_version": "2.0-rc1",
  "kind": "EDITORIAL_PUBLICATION_SET_V1",
  "status": "SEALED_INERT",
  "issue_id": "2026-W33",
  "research_profile": "WEEKLY",
  "publication_profile": "WEEKLY_MAGAZINE",
  "proposal_ref": {
    "path": "sources/2026-W33/publication/v2/editorial-corrections/ed-weekly-full-ren-u-v2/proposal.json",
    "sha256": "362e025a29bf23b8ec03cfa5092bd4138a0630151256ecffe6e1b1e201326e39"
  },
  "staged_manifest_ref": {
    "path": "sources/2026-W33/publication/v2/editorial-corrections/ed-weekly-full-ren-u-v2/staged-source/staged-source-manifest.json",
    "sha256": "e205677b4146ca20ec65bab34bfbf902a2e58577a0c637a44cb27982354a3e3b"
  },
  "build_record_ref": {
    "path": "sources/2026-W33/publication/v2/editorial-corrections/ed-weekly-full-ren-u-v2/publication/build-record.json",
    "sha256": "fa0a3dcc69b5fcf9df7eac7f937f79e5e2c9cbd35c2ac3fe2c79924d0c5e4bbe"
  },
  "roles": {
    "reader-input": {
      "path": "sources/2026-W33/publication/v2/editorial-corrections/ed-weekly-full-ren-u-v2/reader-surface-input-v2.json",
      "sha256": "75aa27422aa6e352c965d08d8a164a375cc1bf0b2e94ab420738a3062a655077",
      "byte_count": 3325
    },
    "authoring-input": {
      "path": "sources/2026-W33/publication/v2/editorial-corrections/ed-weekly-full-ren-u-v2/authoring-input.json",
      "sha256": "d234ee6fe9d6dd905b4a059192cfffc52ef990a311da71442c2f2000f7dc821c",
      "byte_count": 981
    },
    "source-receipt": {
      "path": "sources/2026-W33/publication/v2/editorial-corrections/ed-weekly-full-ren-u-v2/publication/validated-source-manifest.json",
      "sha256": "3feb8af3c77f384ca8ff478e7f35e0f22f16be2ab8bbf9c2cc8c2e0603847852",
      "byte_count": 21801
    },
    "reader-manuscript": {
      "path": "sources/2026-W33/publication/v2/editorial-corrections/ed-weekly-full-ren-u-v2/publication/reader-manuscript-v2.json",
      "sha256": "956bd1d8bc7160205af33a0a7c5ad86fd63bd9a2e0fe23dae546d401b8047415",
      "byte_count": 2651
    },
    "validated-source": {
      "path": "sources/2026-W33/publication/v2/editorial-corrections/ed-weekly-full-ren-u-v2/staged-source/main.tex",
      "sha256": "351f970c43e790a8d9bc1b748f77e4faebbac64edc88bf2db39ec804280a19a4",
      "byte_count": 2295
    },
    "bibliography": {
      "path": "sources/2026-W33/publication/v2/editorial-corrections/ed-weekly-full-ren-u-v2/staged-source/references.bib",
      "sha256": "4c832136678ccebfaf4f73e0d8a5ecc281a080d0189743f6f0541998d1f96dc0",
      "byte_count": 172
    },
    "style": {
      "path": "sources/2026-W33/publication/v2/editorial-corrections/ed-weekly-full-ren-u-v2/staged-source/jgaisurvey.sty",
      "sha256": "035645caa06eb77e5416ae7a54bc1fb7b987e0b575a02bd4b512bccb5d683aec",
      "byte_count": 6569
    },
    "publication-pdf": {
      "path": "sources/2026-W33/publication/v2/editorial-corrections/ed-weekly-full-ren-u-v2/publication/build/main.pdf",
      "sha256": "908ac42a43f083630196a95004bd7900b15b1dfdb7df4be8c0a6d69084f95461",
      "byte_count": 67712
    },
    "build-log": {
      "path": "sources/2026-W33/publication/v2/editorial-corrections/ed-weekly-full-ren-u-v2/publication/build/main.log",
      "sha256": "268dccd87cc0c64920285d268cdc9b3b54ced65be7ee3e5313f629d679c9316a",
      "byte_count": 85527
    },
    "pdf-digest": {
      "path": "sources/2026-W33/publication/v2/editorial-corrections/ed-weekly-full-ren-u-v2/publication/build/main.pdf.sha256",
      "sha256": "6d13e178ef7f7c5d308fb0851d4dd6e8b736b3418cd1d1cee55ec490622ac75e",
      "byte_count": 65
    },
    "quality-regression-bundle": {
      "path": "sources/2026-W33/publication/v2/editorial-corrections/ed-weekly-full-ren-u-v2/publication/quality-regression-bundle-v2.json",
      "sha256": "52f82e721ca1891ed16fb4dc5792927189de167c8fd968a76ae593dedea34ea8",
      "byte_count": 2628
    },
    "semantic-review": {
      "path": "sources/2026-W33/publication/v2/editorial-corrections/ed-weekly-full-ren-u-v2/publication/semantic-editorial-review-v2.json",
      "sha256": "fb2d8fb20ddabd00b401ef9ddbf12b9651dc02fa441560ac09cd36caff0ed0a8",
      "byte_count": 3879
    },
    "visual-review": {
      "path": "sources/2026-W33/publication/v2/editorial-corrections/ed-weekly-full-ren-u-v2/publication/visual-review-v2.json",
      "sha256": "703fb7a0760f741f3d73df57bce946ef35514b64c53ecc84fd2523c9243e571b",
      "byte_count": 1761
    },
    "reader-surface-gate": {
      "path": "sources/2026-W33/publication/v2/editorial-corrections/ed-weekly-full-ren-u-v2/publication/reader-surface-gate-v2.json",
      "sha256": "fd735e69a82738c9c3b4a90d5313cee0a3d2a22fa93056ab2026c0d44a8b3bf0",
      "byte_count": 5498
    },
    "publication-candidate": {
      "path": "sources/2026-W33/publication/v2/editorial-corrections/ed-weekly-full-ren-u-v2/publication/publication-candidate-v2.json",
      "sha256": "cba00bc72bddc4fba01eb9af9d344a06dfd598c4679c2bff28010195f148928f",
      "byte_count": 1873
    }
  },
  "set_sha256": "3fc6e7d6b3f582610dd1b0b4e73de4d0c4a6405d6050f4134c1c66611049da09"
}
